name,free_returns,items_sold,items_status,items_shipping,price
Ergonomic Office Chair Reclining Massage Executive Chair Adjustable Gaming Chair,False,,Brand New,0,9651
Office Chair Adjustable Swivel Drafting Rolling Stool Salon Back Support Foot,False,,Brand New,0,8299
Big & Tall 500lbs Massage Office Chair Executive PU Leather Computer Desk Chair,False,0,Brand New,0,23299
"Height Adjustment RGB LED Racing Gaming , 360 ° Swivel Computer Office Chair",False,,Brand New,0,12599
"New ListingTask Chair with Swivel & Adjustable Height, 225 lb. Capacity, Grey",False,,Brand New,0,4592
Replacement Office Chair Swivel Tilt Seat Mechanism - Free Shipping -  S2979,False,445,Brand New,0,3499
KOLLIEE Armless Office Chair Mesh Ergonomic Small Desk Chair Armless Adjustable,False,,Brand New,0,7000
Gaming Chair Racing Video Ergonomic Massage PU Leather Office Recliner Footrest,False,,Brand New,999,7999
Power Lift Chair Electric Recliner Faux Leather Heated Vibration Massage Sofa,False,,Brand New,0,40999
New Modern Office Executive Chair Ergonomic Mid-back Mesh Computer Desk Chair,True,,Brand New,699,4190
High Back Leather Office Chair Executive Boss Computer Desk Seat Red Stitch,True,492,Brand New,0,10246
Computer Gaming Chair Ergonomic Racing Recliner Footrest Swivel Office Chair Red,True,,Brand New,0,12999
Gaming Chair Ergonomic Computer Swivel Recling Seat Racing Office Leather Chair,False,,Brand New,0,6699
Ergonomic Rolling Mesh Office Chair Computer Desk Task Seat Adjustable US,True,,Brand New,0,3899
"FORTEM Office Chair Seat Cushion, Orthopedic Memory Foam Support, Washable Cover",True,,Brand New,0,1699
