name,free_returns,items_sold,items_status,items_shipping,price
,False,,,,
Home and Office Plastic Stack Chair with Perforated Back - Guest Chair,False,,Brand New,0,5039
Ergonomic Gaming Chair PU Leather Adjustable Office Racing Massage Footrest Home,True,31,Brand New,0,7599
"Racing Style Computer Gaming Chair Ergonomic Recliner Swivel Office Chair,Green",True,,Brand New,0,9499
"Racing Style Computer Gaming Chair Ergonomic Recliner Swivel Office Chair,Blue",True,,Brand New,0,9499
"Steelcase Leap V2 Chair,  -Open Box- Fully Loaded Black Fabric ",True,7302,New – Open box,0,32911
OHAHO Ergonomic Computer Gaming Chair with Footrest Lumbar Massage Support,True,646,Brand New,0,12999
 Herman Miller Aeron Chair Open Box Size B Fully Loaded  ( Black Chair ) ,True,7751,New – Open box,0,59911
Ergonomic Reclining Massage Office Computer Chair Gaming Chair w/ Footrest,True,,Brand New,0,13699
Black Ergonomic Executive Mesh Chair Swivel Mid Back Office Chair Computer Desk ,True,617,Brand New,0,4499
Home Office Desk Chair High Back Mesh Chair Ergonomic Swivel Task Chair Black,False,1543,Brand New,0,5799
Black PU Leather High Back Office Chair Executive Task Ergonomic Computer Desk,True,10000,Brand New,0,11599
 Racing Style Computer Gaming Chair Ergonomic Recliner Swivel Office Chair,True,,Brand New,0,9499
Video Gaming Chair Racing Office Reclining Ergonomic Adjustable Swivel Executive,True,0,Brand New,0,8999
High Back Home Office Desk Chair Ergonomic Swivel Task Chair Gaming Chair Gray ,False,649,Brand New,0,5899
Gaming Chair Racing Ergonomic Recliner Office Chair Computer Desk Chair Swivel,True,129,Brand New,0,10999
Executive Gaming Chair Massage Reclining Swivel Office Chair Desk Computer,True,,Brand New,0,9599
"Home Office Chair Swivel Task Computer Desk Chair w/ Lumbar Support, Grey",False,,Brand New,0,5759
Ergonomic Executive Mesh Chair Swivel Mid-Back Office Chair Computer Desk Gray,True,61,Brand New,599,4599
Massage Gaming Chair Racing Office Computer Desk Swivel Seat Leather Recliner,True,,Brand New,0,7599
"Steelcase Leap  V1  Chair, -Open Box- Fully Loaded Black Fabric",True,555,New – Open box,0,24911
Ergonomic Computer Gaming Chair with Footrest Office Gaming Racing Recliner,True,182,Brand New,1099,8699
Mesh Chair Ergonomic Executive Swivel Office Chair Computer Desk Black,True,1316,Brand New,0,7989
 Herman Miller Fully Loaded Posture fit Size B Aeron Chairs  - Open Box -,True,6236,New – Open box,0,62911
Adjustable Ergonomic Mesh Swivel Computer Office Desk Task Chair Mid-back Black,True,,Brand New,1099,3999
Ergonomic Office Computer Gaming Chair Racing High Back PU Massage Footrest Red,True,127,Brand New,1999,10999
Gaming Chair with Footrest High Back Ergonomic PU Computer Office Racing Chair,True,,Brand New,0,8454
Home Office Chair Ergonomic Desk Chair Mesh Computer Chair with Lumbar Support ,False,2523,Brand New,0,4999
Ergonomic Gaming Chair Racing Style Recliner Computer Seat Swivel Office Chair,True,75,Brand New,0,5899
Gaming Chair Ergonomic Massage Office Chair Swivel Reclining Desk Computer,True,0,Brand New,0,9969
Ergonomic Office Chair Massage Reclining Computer Gaming Chair Height Adjustable,True,,Brand New,0,9999
Gaming Racing Chair Ergonomic Swivel Recliner Leather Computer Desk Office Chair,True,91,Brand New,0,5899
High Back Leather Office Chair Executive Office Desk Task Computer Chair ,False,1638,Brand New,0,9999
2/4 Pack Adjustable Bar Stools PU Leather Modern Dinning Chair with Back Indoor,True,0,Brand New,0,10199
Ergonomic Executive Mesh Chair Swivel Mid-Back Office Chair Computer Desk Black,True,269,Brand New,0,4499
Herman Miller Aeron Chair Mesh Headrest New  Fits A B C Size,False,,Brand New,0,9897
Reclining Swivel Office Chair Desk Computer Gaming Chair,True,0,Brand New,0,6899
Home Office  Chair PU Leather Ergonomic Executive Desk Chair Swivel Mid back,False,,Pre-Owned,0,7999
Office Leather Ergonomic Racing Desk Chair Swivel Computer Chair Gaming Chair,True,104,Brand New,0,5699
Executive Office Computer Desk Chair w/High Back 6-Point Vibration Massagers,False,0,Brand New,0,13229
Massage Executive Office Chair High Back Ergonomic Recline Chair With Footrest,False,,Brand New,0,11999
Ergonomic Mesh Office Chair Midback Adjustable Swivel Computer Desk Task Black,True,792,Brand New,1699,2799
Recliner Chair Single Modern Reclining Sofa  Home Theater Seating Club Chair ,False,810,Brand New,0,15999
Executive Office Chair High-Back Task Ergonomic Computer Desk Study PU Leather,True,147,Brand New,0,10999
Ergonomic Gaming Chair Leather Computer Office Seat Racing Swivel Recliner,True,52,Brand New,0,7999
Ergonomic Office Chair High Back Swivel Mesh Chair Computer Desk Task 9061,False,598,Brand New,0,13299
New Ergonomic Computer Gaming Chair with Footrest Lumbar Massage Support Blue,True,,Brand New,0,7520
Video Game Chair High Back Ergonomic Office Chair Racing Gaming Swivel Chair ,False,0,Brand New,0,5999
Office Leather Ergonomic Executive Desk Chair Swivel Computer Chair Gaming Chair,False,,Pre-Owned,999,6999
New ListingRacing Style Office Computer PU Leather Swivel Gaming Chair Seat High Back,False,,Brand New,0,3500
"Ergonomic Computer Gaming Chair Racing Style Recliner Swivel Office Chair,Pink",True,,Brand New,0,9499
Executive Computer Office Chair Swivel Massage Recliner Gaming Chairs Desk Seat,False,,Brand New,0,13719
Ergonomic Computer Gaming Chair with Footrest Office Desk Recliner Swivel Chair,True,,Brand New,0,9499
Adjustable Ergonomic Mesh Office Swivel Chair Computer Desk Task Chair Mid-back,True,,Brand New,899,3999
Gaming Racing Chair Leather Office Chair Ergonomic Swivel Recliner Computer Seat,True,0,Brand New,0,5999
 400 lbs Executive Office Chair  EC04 High Back Leather Ergonomic Desk Chair ,False,,Brand New,0,14616
Black Mesh Office Chair Computer Middle Back Task Swivel Seat ErgonomicChair1265,False,4278,Brand New,0,4099
Recliner Office Gaming Chair Racing Ergonomic PU Leather High Back Computer Seat,True,,Brand New,0,9999
High Back Mesh Office Chair Adjustable Ergonomic Swivel Computer Desk Task Chair,False,,Brand New,0,8999
Ergonomic Gaming Chair Office Racing Vibration Lumbar Seat Footrest Adjustable,True,,Brand New,1999,10999
GAMING CHAIR RACING COMPUTER LEATHER HIGH BACK RECLINER OFFICE SWIVEL SEAT,False,,Brand New,0,16149
 Aeron Chair By Herman Miller remastered Size B   ( Standard Tilt ) ,True,1795,New – Open box,0,59911
Herman Miller Celle (Aeron) Chair Fully Loaded ,False,112,Refurbished,0,34999
Gaming Chair Ergonomic Computer Office Recliner Footrest Lumbar Massage Support,False,35,Brand New,0,9499
Soft Leather Office Ergonomic Executive Desk Chair Swivel Computer Chair gaming,True,384,Brand New,0,9999
Gaming Chair Racing Recliner Office Computer Chair Swivel Footrest Chair Wheel,False,109,Brand New,0,2199
Mid-Back Ergonomic Mesh Office Chair Home Desk Executive Swivel Task Chair Black,True,,Brand New,0,5999
,False,,,,
High Back Mesh Office Desk Computer Chair Executive Lumbar Support Swivel Home,True,,Brand New,0,3990
Ergonomic Executive Mesh Office Chair Swivel Chair Computer Desk High Back Task,True,55,Brand New,0,12590
Office Drafting Chair Stool Ergonomic PU Computer Height Adjustable Swivel,True,,Brand New,0,11999
Office Ergomomic Heated Vibrating Massage Chair PU Leather  Swivel Computer Seat,False,101,Brand New,0,8549
Leather Gaming Racing Chair Ergonomic Recliner Executive Office Computer Chair,True,0,Brand New,0,5899
Ergonomic Gaming Chair Swivel Office Computer Chair PU Leather Recliner Footrest,False,,Brand New,0,9199
Gaming Chair Office Racing Swivel Desk Chair PU Leather Computer Seat Ergonomic,False,,Brand New,0,6599
ERGONOMIC GAMING RACING CHAIR COMPUTER DESK SWIVEL OFFICE EXECUTIVE PU LEATHER,False,0,Brand New,0,6878
Computer Gaming Chair Ergonomic High-back Racing Swivel Leather Office Chair ,True,,Brand New,0,7999
"Ergonomic Office Chair, Swivel Computer Mesh Seat w/ Armrest Adjustable Wheels",True,0,Brand New,0,5896
Leather Executive Office Desk Chair Ergonomic Swivel Racing Chair Gaming Chair,True,,Brand New,0,5799
Office Executive Chair Task Desk Adjustable Swivel W/Rolling Wheels Velvet,True,8,Brand New,0,9999
Ergonomic Gaming Chair Leather Executive Office Chair Swivel Racing Chair ,True,0,Brand New,0,5699
Ergonomic Office Chair Linen Adjustable Swivel Computer Seat Armless Home Black,True,0,Brand New,0,6649
"Hot new Steel Metal Folding Chair, Black, 4-Pack",False,,Brand New,0,5307
Ergonomic High Back Mesh Office Chair Adjustable Swivel PC Executive Home Desk,False,,Brand New,0,9000
Gaming Chair Recliner Racing Chair W/RGB LED Lights & Massage Lumbar Support,False,0,Brand New,0,16900
"STEELCASE LEAP V2 OFFICE DESK CHAIR, FULLY LOADED ",False,,Refurbished,0,32500
Computer Gaming Chair Racing Ergonomic Recliner Office Seat Swivel w/ Footrest,True,,Brand New,0,7520
Adjustable Ergonomic Mesh Swivel Computer Office Desk Task Rolling Chair MidBack,True,237,Brand New,0,4896
Home Office Chair Ergonomic Desk Chair Mesh Computer Chair with Lumbar Support,False,0,Brand New,0,4049
Leather Executive Office Chair Ergonomic Swivel Computer Gaming Chair Recliner ,True,13,Brand New,0,5899
"Steelcase Leap V2 Task Chair, Platinum Frame, Yellow (Mustard) Fabric.",False,0,Refurbished,0,37500
Executive High Back PU Leather Computer Desk Ergonomic Task Office Chair Brown,True,764,Brand New,0,9999
Herman Miller Aeron Mesh Office Desk Chair Medium Size B fully adjustable lumbar,False,568,Refurbished,9900,49909
Gaming Chair Reclining Racing Chair w/Lumbar Support Office Chair Computer Seat,True,,Brand New,0,7999
Steelcase Amia (Leap V2) Task Chair - Fully Adjustable - Blue Fabric,False,,Refurbished,0,28999
High Back Home Office Chair PU Leather Executive Chairs Swivel Chairs w/ Wheels,False,0,Brand New,0,8599
Brown PU Leather High Back Office Chair Executive Task Ergonomic Computer Desk,True,277,Brand New,0,11999
Simple Deluxe Office Chair Ergonomic Mesh Computer Chair With Wheels Adjustable,True,0,Brand New,0,3899
Amia  Chair by Steelcase - open box ,True,165,New – Open box,0,29909
NEW! ZUNA OFFICE DESK CHAIR - MID-BACK MESH TASK CHAIR - ADJUSTABLE HEIGHT,True,0,Brand New,0,7979
"Office Chair Adjust Height Recliner with Retractable Footrest, Wheel, High Back",False,0,Brand New,0,17799
Leather Executive Office Desk Chair Ergonomic Swivel Computer Chair Gaming Chair,True,,Brand New,0,5999
Gaming Chair Recliner Racing Chair w/RGB LED Lights & Massage Lumbar Support Red,False,0,Brand New,0,20998
Executive Racing Gaming Chair Ergonomic Swivel Desk Seat Office Furniture Pink,False,,Brand New,0,9999
Leather Ergonomic Executive Office Computer Chair Swivel Recliner Gaming Chair,True,0,Brand New,0,5299
Ergonomic Mesh Swivel Computer Office Desk Task Rolling Chair MidBack Adjustable,False,,Brand New,0,6299
"FORTEM Chair Seat Cushion & Lumbar Support Back Pillow, Orthopedic Memory Foam",True,,Brand New,0,2499
Ergonomic Massage Office Gaming Chair Recliner Computer Task with Footrest Red,True,0,Brand New,0,9999
New ListingSteelcase Leap v2 Office Chair  - Black,False,,Brand New,3183,9400
Replacement Office Chair Adjustable and T-Arm Pad Armrest Top Cap 1 Pair (2pc),False,626,Brand New,0,1695
Ergonomic Mesh Office Chair with Head Rest Height Adjustable Computer Chair,False,,Brand New,0,6000
Office Chair Rolling Ergonomic MidBack Adjustable Computer Task Desk Swivel Seat,True,,Brand New,0,5996
High Back Executive Office Chair PU Leather Ergonomic Computer Desk Task Seat,False,71,Brand New,0,13299
Fabric Recliner Mid-Century Single Reclining Chair Adjustable Back & Footrest,False,162,Brand New,1999,13899
Office Chair Executive Computer Desk Chair Gaming - Ergonomic High Back Support,False,87,Brand New,0,12498
New ListingOffice Computer Chair Mesh Ergonomic Swivel High Back Adjustable Lumbar Support,True,,Brand New,0,11999
New ListingOffice Computer Chair Mesh Ergonomic Swivel Adjustable w/Lumbar Support Black,True,,Brand New,0,11999
Ergonomic Mesh Office Chair Midback Adjustable Swivel Computer Desk Task Black,True,510,Brand New,0,5499
Autonomous Ergochair Pro (Ergonomic Desk Chair) - Black & White,False,0,Brand New,0,34900
Ergonomic High Back Mesh Office Chair Adjustable 360° Swivel Executive Home Desk,False,,Brand New,0,7299
Big and Tall Office Chair 500lbs Wide Seat Desk Chair Ergonomic Computer Chair ,False,134,Brand New,0,18999
Gaming Chair Racing Office Chair Computer Chair with RGB LED Lights & Massage,False,17,Brand New,0,14799
Ergonomic Office Chair Massage Reclining Computer Gaming Chair w / Footrest,True,,Brand New,0,13259
Computer Gaming Chair Ergonomic Racing Style Recliner Swivel Leather Office Seat,False,0,Brand New,0,6699
New Listing2PCS High-Back Office Chairs w/ Armrests Modern PU Leather Desk Chair 360°Swivel,False,,Brand New,0,5599
Polar Aurora Gaming Recliner Chair sofa PU Leather Vibratory Ergonomic Lounge,False,0,Brand New,0,17999
Office Gaming Chair Racing Desk Chair Ergonomic Computer Chair Swivel Task Chair,False,,Brand New,0,5989
New ListingGaming Office Chair Racing Computer Ergonomic Swivel Recliner with Footrest Grey,True,,Brand New,0,19999
Ergonomic Office Gaming Chair High Back Swivel Recliner Task Chair Compute,True,,Brand New,0,8553
High Back Office Chair Black PU Soft Leather Executive Ergonomic Computer Desk,True,596,Brand New,0,9999
Brown Massage Recliner Chair Heated Rocking Vibration Sofa 360° Swivel w/Remote,True,132,Brand New,0,29999
Armless Black Tall Office Desk Chair with adjustable seat,False,,Pre-Owned,,6000
LEATHER ERGONOMIC GAMING RACING CHAIR COMPUTER SWIVEL OFFICE CHAIR PADDED SEAT,True,,Brand New,0,9699
Ergonomic Gaming Chair Height Adjustable Office Chair Racing w/ Massage Footrest,True,,Brand New,0,7590
,False,,,,
"Adjustable High Back Gaming Chair Racing Office Recliner w/ Footrest, Pillow",False,61,Brand New,,17599
GTRACING Gaming Chair Racing Ergonomic Office Swivel Recliner with free pillows,True,13,Brand New,0,13599
"Racing Style Gaming Office Recliner, Reclining Video Game Chair",False,,Brand New,,24199
Ergonomic Computer Gaming Chair Office Reclining with Footrest Lumbar Massage US,True,0,Brand New,0,8999
2Pc Swivel Ergonomic Adjustable Mesh Office Desk Chair w/ Lumbar Support Armrest,True,19,Brand New,0,5789
Computer Gaming Chair Office Chair Executive Swivel Racing Chair Black/White,False,75,Brand New,0,8199
"HON OFFICE CHAIR PARTS ARM PAD ARMREST REPLACEMENT 1 PAIR, 2 PCS #MIKE",False,720,Brand New,0,1995
Liberty Chair -   by Humanscale  (freedom ) ,True,99,New – Open box,0,19911
New ListingGaming Office Chair Racing Computer Ergonomic Swivel Recliner w/Footrest Purple,True,,Brand New,0,19999
Gaming Chair Ergonomic Racing Office Computer Desk Massage Recliner Chair Swivel,True,0,Brand New,0,10099
Ergonomic Mesh Swivel Computer Office Desk Task Caster Chair Mid Back Adjustable,True,0,Brand New,0,5999
Gaming Racing Chair Ergonomic Swivel Recliner Leather Computer Desk Office Chair,False,0,Brand New,0,4616
Ergonomic Swivel Mid Back Computer Office Desk Mesh Chair Heavy Duty Metal Base,True,0,Brand New,0,4499
High-Back PU Leather Ribbed Office Chair Adjustable Swivel Desk Task Chair White,False,,Brand New,0,8549
Office Star FL61903C Executive Modern Mid Back Swivel Chair Charcoal Grey,True,,Pre-Owned,0,4379
Ergonomic Computer Gaming Chair with Footrest Office Gaming Racing Recliner,False,,Brand New,0,11299
CLATINA Ergonomic Big & Tall Executive Office Chair with Bonded Leather 400lbs ,True,,Brand New,0,13990
Height Adjustable Computer Chair Home Office Chair w Footrest Recline & Massage,True,,Brand New,5301,6090
Rolling Swivel Salon Stool Chair with Back Support Adjustable Hydraulic Office,True,116,Brand New,0,5440
New ListingComputer Desk Chair PC Swive Reclinel Office Chair White Ergonomic Gaming Chair,False,,Brand New,999,11199
New ListingComputer Desk Chair Swive Reclinel Office Chair White Ergonomic PC Gaming Chair ,False,,Brand New,999,11399
Ergonomic Mesh Task Drafting Chair with Lumbar Support Office Chair,True,118,Brand New,1999,6050
Executive Mesh Chair Swivel Mid-Back Office Chair Ergonomic Computer Desk Black,True,0,Brand New,0,4499
Executive Office Chair High Back Computer Gaming Chair PU Leather Swivel Recline,False,,Brand New,0,9099
Ergonomic Wooden Kneeling Chair Rocking Balancing Kneel Stool Linen Cushion New,False,0,Brand New,0,6799
Racing Gaming Chair Ergonomic Computer Recliner Office Desk Seat with Footrest,True,0,Brand New,0,10199
Massage Reclining Swivel Office Chair Desk Computer Gaming Chair w/ Footrest,True,,Brand New,1401,10510
Drafting Chair Tall Office Chair Adjustable Height with Lumbar Support Arms Foot,False,189,Brand New,0,8999
"Big and Tall Computer Desk Chair with 48"" Adjustable Height, Light Grey",False,,Brand New,0,21999
Gaming Chair Racing Ergonomic Recliner Office Swivel Leather Computer Desk Seat,False,,Brand New,0,8999
Ergonomic Gaming Chair Bluetooth Speakers Footrest Office Massage Swivel Chair,True,,Brand New,0,26999
Floor Rocking Gaming Chair Play 2.0 Wired Red With Speaker High Tech New,False,0,Brand New,0,7438
Ergonomic Computer Desk Chair Adjustable 360 Swivel Office Executive Task Chair,False,0,Brand New,0,9999
New ListingGaming Office Chair Racing Computer Ergonomic Swivel Recliner with Footrest Red,True,,Brand New,0,19999
Blue Gaming Chair Racing Ergonomic Recliner Massage Computer Desk Chair Swivel,True,,Brand New,0,8000
(10 PACK) Commercial Wedding Quality Stackable Plastic Folding Chairs White,True,1276,Brand New,0,18999
"Mesh Office Chair with Leather Seat, Ergonomic Rolling Computer Desk Chair Brown",False,,Brand New,0,7599
FelixKing FK918 Ergonomic Desk Chair w Adjustable Height w Lumbar Support,True,,Pre-Owned,0,8657
Massage Gaming Recliner Single Chair Footrest USB Adjustable Storage Modern PU ,True,,Brand New,0,18900
Ergonomic Kneeling Office Chair w/ Adjustable Stool Thick Foam Cushions White,True,,Brand New,0,6999
New ListingErgonomic Gaming Chair PC Swive Reclinel Office Chair BLUE Computer Desk Chair,False,,Brand New,999,11999
High Back Swivel Computer Racing Gaming Chair w/ Rest Footrest Home Office ,False,,Brand New,0,12999
New ListingGaming Office Chair Racing Computer Ergonomic Swivel Recliner with Footrest Pink,True,,Brand New,0,19999
EXECUTIVE CHAIR by HAWORTH ZODY in Black COLOR LOADED CHAIR* desk mesh chair,False,,Refurbished,0,24266
Home Office Desk Chairs Ergonomic Executive Chair Swivel Task Chair,True,,Brand New,599,3899
High brown PU Leather Executive Office Desk Task Computer boss luxury Chair NEW,True,1485,Brand New,0,9999
New ListingGaming Office Chair Racing Computer Ergonomic Swivel Recliner with Footrest Blue,True,,Brand New,0,19999
Steelcase Gesture Ergonomic Office Chair| Fully Loaded,False,,Pre-Owned,0,67575
Ergonomic Computer Gaming Desk Chair W/Footrest Lumbar Massage Support Red US,True,,Brand New,0,9312
Computer Gaming Racing Chair Leather High-back Office Recliner Desk Seat Swivel,True,,Brand New,0,8719
New Computer Desk Chair Gaming Chair Racing Ergonomic Recliner Swivel Blue,True,,Brand New,0,7610
New ListingHercules Chair Big & Tall 500 lb. Rated Brown LeatherSoft Executive Swivel Ergo,False,0,Brand New,0,3600
"Adjustable High Back Gaming Chair Racing Office Recliner w/ Footrest, Pillow",False,0,Brand New,,15799
Height Adjustable Computer Gaming Chair Massage Reclining Ergonomic Office Chair,True,,Brand New,0,9465
High-end Office Leather Executive Desk Chair Swivel Computer Chair Modern Brown,False,,Brand New,0,12489
"Aloudy Ergonomic Memory Foam Office Chair Armrest Pads, Comfy Gaming 2 per Pack",False,,Brand New,0,1399
New ListingLuxury Reclining Office Chair Gaming Chair Massage Swivel Computer Seat Leather ,False,,Brand New,0,13599
Black PU Leather High Back Office Chair Executive Ergonomic Computer Desk Swivel,True,255,Brand New,0,9699
Heavy Duty Leather Office Rolling Computer Chair Brown High Back Executive Desk ,True,183,Brand New,0,15324
Upgrade Racing Gaming Chair Heavy Duty Ergonomic Office Adjustable angle Height,True,,Brand New,0,7221
1/2/3/4 Seat Stretch Spandex Chair Sofa Couch Cover Elastic Slipcover Protector,False,,Brand New,0,1599
"MAINSTAYS BONDED LEATHER MID BACK MANAGERS OFFICE CHAIR, BLACK *DM",False,0,New – Open box,0,6499
Heavy Duty Gaming Chair Ergonomic Recliner Office Computer Seat Swivel Footrest,False,,Brand New,0,9299
Herman Miller Aeron Chair - Size C (Large) in Graphite/Black with Posture-Fit,False,0,Pre-Owned,7500,76950
Massage Gaming Chair Office Computer Swivel Seat with Footrest Lumber Support US,True,,Brand New,0,7646
Massage Reclining Swivel Office Chair Desk Computer Gaming Chair w / Footrest,True,,Brand New,0,13449
,False,,,,
CLATINA High Back Mesh Office Desk Chair with Lumbar Support for Home Teens,True,,Brand New,0,3999
Gaming Racing Chair Ergonomic Office Office Vibration Seat Adjustable PU Massage,True,,Brand New,0,10499
PHI VILLA Patio Chair Set of 2 Metal Rocker Swivel Chairs Outdoor Furniture,False,,Brand New,0,19999
4pcs Christmas Decor Chair Covers Dining Seat Cover Santa Claus Home Party Decor,True,219,Brand New,0,1499
Brown Parson Chairs Kitchen Set of 6 Dining Room Formal Elegant Leather Design,True,123,Brand New,0,26499
Gaming Chair Racing Computer Leather High Back Recliner Office Desk Swivel Seat,False,70,Brand New,0,13869
Blush Bungee office Chair from The Container Store,False,,Brand New,0,12500
Serta Big and Tall Leather Commercial Office Chair with Memory Foam Brown,False,0,Brand New,0,14900
New ListingPC Computer Gaming Chair Ergonomic Racing Recliner Footrest Swivel Office Chair,True,,Brand New,0,12999
"PMI ProBasics Adult Shower Bath Chair Seat, without Back, 250 lb Capacity",False,,Brand New,0,2399
Big and Tall Manager Chair Mesh Fabric Serta Office Furniture Computer Executive,False,0,Brand New,0,11099
NEO CHAIR Office Chair Computer Desk Chair Gaming - Bulk Business Ergonomic Mesh,False,76,Brand New,0,11998
New Ergonomic Mesh Computer Office Desk Midback Task Chair w/Metal Base H03,False,1101,Brand New,0,4999
Adjustable Bar Stool Swivel Counter Height Chairs Padded Barstool Brown,False,71,Brand New,0,8999
180° Recliner Ergonomic Office Chair Racing Gaming Chair PU Computer Desk ,False,,Brand New,0,8999
Set of 4 Elegant Tufted Design Fabric Upholstered Modern Dining Chairs Armless,True,,Brand New,0,21690
Garden Patio Outdoor Furniture Cover Chair Table Covers Rectangular Waterproof,True,63,Brand New,0,1967
"OFM High-Back Racing Style Bonded Leather Gaming Chair, Purple ",False,0,Brand New,0,15494
Executive Office Chair Ergonomic Gaming Chair Swivel Computer Desk Seat ,True,0,Brand New,0,8699
Herman Miller Aeron Chairs - Size B - Fully Adjustable w/Posture-Fit,True,0,Refurbished,0,61995
Ergonomic computer Office Chair Heavy Duty Lumbar Support High-Back Swivel,False,,Brand New,0,7999
Adjustable Posture Chair Work Desk Stool Home Office Ergonomic Kneeling Chairs ,False,,Brand New,0,4799
Adjustable bentwood Ergonomic Kneeling Chair Stool Strengthen Muscles Furniture,True,121,Brand New,0,7597
Office Mesh Chair Ergonomic Computer Desk Mid Back Swivel Task Rolling Seat New,False,0,Brand New,0,3799
White Desk Chairs w/ Wheels/Armrests Leather Office Chair Executive Chair 360°,True,223,Brand New,0,7599
Office Desk Chairs Ergonomic Executive Chair High Back Swivel Task Chair Home ,False,0,Brand New,0,5699
Home Office Chair Ergonomic Desk Chair Mesh Computer Chair with Lumbar Support,False,,Brand New,0,6999
GTPLAYER Gaming Recliner Chair with Footrest Home Theater Single Sofa ,True,,Brand New,0,26999
Big & Tall 500lbs Massage Office Chair Executive PU Leather Computer Desk Chair,False,0,Brand New,0,23998
RESPAWN RSP-110 Racing Style Gaming Reclining Ergonomic Chair w Footrest Gray,True,,New – Open box,0,11952
360 Degree Swivel Gaming Floor Chair w/Armrest Handles Foldable Adjustable Back,True,,Brand New,0,6799
New ListingErgonomic Office Chair High-Back PU Leather Computer Chair Adjustable 360°Swivel,False,,Brand New,0,5599
Office Chair Home Desk Chair Computer Chair Adjustable Rolling Swivel Chair,True,305,Brand New,899,6889
Office Career Leather Ergonomic Executive Desk Chair Computer Chair Gaming Chair,False,,Brand New,0,11499
New ListingErgonomic High Back Massage Gaming Chair with Light and Handrails,False,,Brand New,0,33460
 IKEA SWIVEL BLACK DESK CHAIR (BASICALLY NEW),False,,Pre-Owned,,2999
Drafting Chair Tall Office Chair Adjustable Height with Arms Foot Rest Back,False,,Brand New,0,8999
Home Office Desk Chair High Back Mesh Chair Ergonomic Swivel Task Chair Black,False,0,Brand New,0,5399
Home Office Chair Mesh Desk Chair Ergonomic Computer Chair with 3D Arms Back Lum,False,,Brand New,0,15999
Set of 2 Velvet Armchair Modern Contemporary Accent Chair Living Room Bedroom ,False,0,Brand New,0,25599
Ergonomic Home Office Computer Gaming Chair Swivel Recliner Seat with Footrest,True,,Brand New,0,12999
Classic Hydraulic Barber Chair Salon Hair Styling Beauty Spa Shampoo Equipment,True,2078,Brand New,0,13999
New ListingRed Ergonomic Computer Gaming Chair Office Reclining w/ Footrest Lumbar Massage,False,,Brand New,,7500
New ListingGaming Chair With Bluetooth Light Seat Height Adjustment Home Office Chair,False,,Brand New,0,12998
New Listinggaming chair ,False,,Brand New,0,10000
Ergonomic Gaming Racing Chair Computer Executive Office Desk Seat Swivel Recline,False,0,Brand New,0,6699
Modern Durable  Fabric Wood legs  Single Recreational Accent Chair Sofa Beige,True,,Brand New,0,14969
Ergonomic Gaming Chair Office Computer Racing Footrest Recline Vibration Message,True,,Brand New,0,10999
Ergonomic Middle Back Office Chair Executive Adjustable Computer Desk,True,,Brand New,0,4399
Leather Sex Couch Loveseat Exotic Furniture Sofa Chaise Lounge Yoga Chair,False,294,Brand New,0,20995
NEW Ergonomic Kneeling Wood Office Chair w/Height Adj. Brown Velour Covered Seat,False,0,Brand New,0,5995
