name,free_returns,items_sold,items_status,items_shipping,price
,False,,,,
Laptop Stand Tablet Holder Riser Aluminum For MacBook Air/Pro 13 15 iPad Pro12.9,False,,Brand New,0,2699
Portable Adjustable Aluminum Alloy Laptop Stand Notebook Tablet Holder Foldable,False,278,Brand New,0,1086
Portable Foldable Laptop Notebook Table Adjustable Stand Bed Tray computer Desk ,False,675,Brand New,0,2400
Portable Adjustable Notebook Tablet Holder Laptop Stand Foldable Computer Desk,False,,Brand New,,1099
NEW Universal laptop stand Ergonomic aluminum stand for 10-17 inch laptop ,True,0,Brand New,0,1499
Portable Adjustable Foldable Laptop Desktop Stand Notebook Tablet Riser Holder,True,,Brand New,0,895
Adjustable Foldable Laptop Desktop Stand Notebook Tablet Holder Riser Portable,True,86,Brand New,0,799
"NEW Laptop Stand, Ergonomic Aluminum Computer Stand for 10-17'' Notebook BK/SR",True,136,Brand New,0,1799
Portable Adjustable Aluminum alloy Laptop Stand Notebook Tablet Holder Foldable,True,501,Brand New,0,1296
Durable Portable Foldable Notebook Laptop Desk Table Stand Bed Tray Cooling rack,True,709,Brand New,0,949
Portable Stand Bed Tray Sofa Adjustable Laptop Table Computer Desk Notebook Tray,False,,Brand New,0,1600
Durable Portable Foldable Notebook Laptop Desk Table Stand Bed Tray W/Cup Pad,True,,Brand New,0,2199
Portable Laptop Notebook Table Foldable Stand Sofa Bed Lap Tray Computer Desk,True,122,Brand New,0,3099
Portable Laptop Stand Adjustable Foldable Notebook Tablet Holder Computer Desk,False,,Brand New,0,999
C Steering Wheel Desk Laptop Tray Eating Food Table Mount Work Stand Holder,False,54,Brand New,0,1599
Aluminum Adjustable Laptop Stand Notebook Tablet Holder Foldable Computer Desk,True,,Brand New,0,1295
Laptop Stand Aluminum Alloy Tablet Desk Holder For iPad 10.2 8th/Air 1 2 3 2020,False,,Brand New,0,1891
360°Adjustable Folding Laptop Notebook Desk+Cooling Fan Table Stand Bed Tray,True,,Brand New,0,1999
Portable Adjustable Laptop Stand Notebook Tablet Holder Foldable Computer Desk,True,44,Brand New,0,1198
Portable Laptop Desk Folding Foldable Lap Tray Bed Adjustable Table Stand Bamboo,False,305,Brand New,0,2507
Adjustable Foldable Laptop Stand Desk Portable Notebook Riser Computer Holder,True,,Brand New,0,819
Portable Foldable Laptop Notebook Desk Table Adjustable Stand with phone holder ,True,,Brand New,0,1799
Laptop Stand Ergonomic Detachabler Holder For MacBook Air Pro Dell XPS HP Lenovo,True,,Brand New,0,1499
Portable Adjustable Laptop Stand Notebook Tablet Holder Foldable Notebook Desk,False,,Brand New,0,839
Folding DJ Laptop Stand – Computer Table Top PC Rack Clamp Mount Holder PA Gear,True,,Brand New,0,3095
Foldable Laptop Tablet Stand Adjustable Support Bracket for iPad Macbook Holder,False,,Brand New,0,839
 2 Tier Monitor Stand Riser with Vented Metal Base Desk Organizer Laptop Stand,True,0,Brand New,0,2099
Portable Laptop Notebook Table Foldable Stand Sofa Bed Lap Tray Computer Desk...,True,,Open Box,0,3499
Portable 360° Adjustable Laptop Notebook Table Stand Tray Foldable Computer Desk,False,,Brand New,0,1600
Adjustable Tilt Stand Laptop Rolling Desk Portable Caster Cart Bed Side Table ,False,27,Brand New,,3799
Lap Desk Laptop Stand Tray w/ Pillow Cushion Bamboo Bed Table Tray Tablet Holder,True,,Brand New,0,2612
Vertical Laptop Stand Desktop Stand Holder w/ Adjustable Dock for MacBook US,False,,Brand New,0,1928
Premium Rolling Laptop Desk Height Adjustable Over Bed Sofa Table Stand,True,592,Brand New,1499,2998
Portable Adjustable Laptop Stand Notebook Tablet Holder Foldable Computer Desk,False,,Brand New,,839
Adjustable Laptop MacBook Stand Notebook Tablet Holder Foldable Computer Desk US,True,,Brand New,,1299
"Laptop Stand,  Aluminum Computer Riser, Ergonomic Detachable Portable",False,,Brand New,0,2799
Portable Adjustable Laptop Stand Notebook Tablet Holder Foldable Computer Desk,True,,Brand New,0,1448
360° Adjustable Laptop Table Stand Lap Sofa Bed Tray Computer Notebook Desk,True,,Brand New,0,2120
"Portable Laptop Stand, Computer Keyboard Tablet iPhone iPad Notebook Stand Riser",True,51,Brand New,0,798
Adjustable Laptop Stand Computer Holder Riser Tablet Stand Holder Foldable Alloy,True,,Brand New,0,1299
Portable Adjustable Aluminum alloy Laptop Stand Notebook Tablet Holder Foldable,False,,Brand New,0,1598
"Vertical Laptop Stand, Automatic Adjustable without Tools Laptop Holder, Gray",True,,Brand New,0,1590
Angle Height Adjustable Rolling Laptop Desk Over Sofa Bed Notebook Table Stand,True,1699,Brand New,0,4498
Adjustable Ergonomic Aluminum Laptop Stand Portable Notebook Tablet Holder Riser,False,0,Brand New,299,2442
Foldable Laptop Table Stand Lap Sofa Bed Tray Computer Notebook Desk Adjustable,True,,Brand New,0,1219
Portable Laptop Computer Desk Table Bed Sofa Folding Adjustable Width Stand Tray,False,,Brand New,0,1687
Laptop Notebook Table Foldable Stand Breakfast Serving Bed Tray Computer Desk,False,0,Brand New,0,2059
Adjustable Foldable Laptop Stand Aluminum Notebook Riser Computer Holder Desk,False,,Brand New,0,2799
CAR LAPTOP MOUNT TRUCK VEHICLE NOTEBOOK STAND HOLDER WITH NON-DRILLING BRACKET,False,50,Brand New,1000,5690
Adjustable Laptop Notebook Fold Desk Table Stand Bed Tray with Cooling Fan NEW,True,155,Pre-Owned,0,1899
Portable Laptop Stand Adjustable Foldable Notebook Tablet Holder Computer Desk,True,,Brand New,0,839
"3 Type Monitor Stand Riser for Laptop, Computer, iMac, Printer, Notebook，Black",True,,Brand New,0,1539
Car Laptop Mount Truck Vehicle Notebook Stand Holder w/ No Drilling Bracket,False,246,Brand New,0,6890
Adjustable Foldable Portable Laptop Stand Riser Laptop Computer Tablet Holder,False,,Brand New,0,1099
Laptop Stand W Phone Holder Foldable Computer Lift 360 Rotating Swivel Base Adju,True,,Brand New,0,1486
Portable Laptop Steering Wheel Desk Car Mount Holder Eating Tray Stand Foldable,False,0,Brand New,0,2539
 Laptop Stand Portable Foldable Height,False,25,Open Box,0,3899
Portable Laptop Notebook Table Foldable Stand Sofa Bed Lap Tray Computer Desk US,False,,Brand New,0,3445
Laptop Stand Ergonomic Mesh Ventilated Adjustable Portable Computer Riser Black,False,0,Open Box,0,1899
360°Adjustable Portable Foldable Laptop Notebook Desk Table Stand Bed Tray_,True,0,Brand New,0,1999
Portable Adjustable Notebook Tablet Holder Laptop Stand Foldable Computer Desk,False,,Brand New,0,1008
Vertical Laptop Stand for Macbook Air Pro Desktop Stand with Adjustable Dock~,False,22,Brand New,0,1110
New ListingThe Roost V3 Laptop Stand,True,0,Pre-Owned,955,999
360°Adjustable Folding Laptop Cooling Desk Table Sofa Bed Notebook Stand Tray,False,,Brand New,0,1600
360°Adjustable Folding Laptop Cooling Desk Table Sofa Bed Notebook Stand Tray,False,,Brand New,0,1600
"Laptop Stand Holder Adjustable Height Foldable for 10-15.6"" Notebook Computer",False,,Brand New,0,2999
,False,,,,
Universal Tablet Laptop Pad Stand Holder Riser Folding Table Adjustable Support,True,676,Brand New,,1329
"Portable Laptop Stand Adjustable Height for Work Desk with Phone Holder, 10-18in",False,,Brand New,0,1299
MOFT Lightweight Portable Laptop  Adjustable Stand Grey MacBook Universal,True,,Brand New,0,1377
Angle & Height Adjustable Rolling Laptop Desk Cart Over Bed Hospital Table Stand,False,0,Brand New,,3898
Portable Laptop Stand Desk Macbook Hold Adjustable Support Base Notebook Bracket,False,,Brand New,0,952
Car Steering Wheel Tray Chair Dining Table Cup Holder Laptop GPS Desk Stand New,False,0,Brand New,0,1079
Adjustable Laptop Table Stand Lap Tray Sofa Bed Notebook Computer Foldable Desk,False,,Brand New,0,3125
Baseltek Aluminum Laptop Cooling Platform Stand for Macbook Air Pro and iPad,True,105,Brand New,0,1299
Projector Laptop Tripod Stand W/ Tray Laptop Camera Adjustable Home Office Stand,False,,Brand New,0,4065
Portable Adjustable Notebook Tablet Holder Laptop Stand Foldable Computer Desk,True,,Brand New,0,1135
Laptop Stand Notebook Tablet Holder Adjustable Foldable Computer Desk Portable,False,,Brand New,0,1457
Adjustable Laptop Stand Tray With CPU COOLING Fan & Removeable Mouse ,False,0,Brand New,0,7999
Portable Laptop Desk Folding Foldable Lap Tray Bed Adjustable Table Stand Sofa,True,,Brand New,0,1219
Foldable Adjustable Notebook Tablet Holder Laptop Stand Portable Computer Desk,True,,Brand New,0,798
Portable Office Laptop Desk Rolling Adjustable Table Cart Computer Mobile Stand,False,0,Brand New,0,3699
Portable Laptop Notebook Adjustable Aluminum Stand Table Holder Ergonomic Riser,True,0,Brand New,,4599
Portable Laptop Desk Folding Foldable Lap Tray Bed Adjustable Table Stand Bamboo,False,58,Brand New,0,2506
"Steklo Macbook Laptop stand, riser adjustable 12 inch to 17 inch",False,,Pre-Owned,0,1099
Portable Adjustable Notebook Tablet Holder Laptop Stand Foldable Computer Desk,True,,Brand New,0,1595
Laptop Stand Adjustable & Portable Aluminum Notebook Tablet Desk Holder US Stock,True,0,Brand New,0,976
Portable Laptop Notebook Table Foldable Stand Sofa Bed Lap Tray Computer Desk,False,,Brand New,0,1999
Portable Adjustable Aluminum alloy Laptop Stand Notebook Tablet Holder Foldable-,False,,Brand New,0,977
Adjustable Laptop Stand Foldable Notebook Table Lap Sofa Bed Tray Computer Desk,False,,Brand New,0,2399
Portable Adjustable Notebook Tablet Holder Laptop Stand Foldable Computer Riser,True,,Brand New,,995
Portable Foldable Laptop Notebook Table Stand Sofa Bed Lap Tray Computer Desk,False,,Brand New,0,2375
Rain Design mStand Silver Notebook/Laptop/MacBook Aluminum Computer Riser Stand,False,,Pre-Owned,1438,999
JoiseTech Ergonomic Laptop Desk Stand Portable Foldable Adjustable Notebook Hold,True,,Brand New,0,2997
Rain Design 10032 Laptop Stand - Silver Apple MacBook Pro Air M1 MStand,True,,Pre-Owned,1275,1999
Portable Adjustable Folding Laptop Desk Foldable Study Computer Bed Table Stand,False,,Brand New,0,1999
"Laptop stand mount Tablet Riser Holder Aluminum For 10""-17"" Laptop Netobook",True,,Brand New,0,2469
Adjustable Foldable Portable Laptop Stand Riser Laptop Computer Tablet Holder,False,,Brand New,0,998
"10 to 17 inches Laptop Stand, Adjustable Aluminum Computer Stand for Desk",False,36,Brand New,0,2500
12'' Laptop Stand Tray Height Adjustable Viewing Angle Adjustable,False,0,Brand New,0,4599
"Adjustable 47""/63"" Projector Stand Tripod Laptop Tripod Stand Holder w/Tray US",True,,Brand New,0,2699
Laptop Stand Adjustable Laptop Computer Stand Multi-Angle Stand Phone Stand Port,False,,Brand New,1595,699
Portable Laptop Desk Bamboo Foldable Lap Tray Bed Adjustable Table Stand,False,56,Brand New,0,2508
Portable laptop plastic stand,False,,Brand New,0,1500
Black Laptop Stand Ergonomic Aluminum Computer Stand for 10-17'' Notebook Silver,True,,Brand New,0,1699
Adjustable Foldable Laptop Stand For Desk Tablet Notebook Riser Computer Holder,True,,Brand New,,928
Adjustable Foldable Laptop Stand Fr Desk Portable Notebook Riser Computer Holder,True,,Brand New,0,1295
Baseus Laptop Stand Riser for MacBook Air Pro Foldable Portable Notebook Stand,False,,Brand New,0,2399
360° Rotation Laptop Table Stand Lap Sofa Bed Tray Computer Notebook Home Desk,False,,Brand New,0,1999
Aluminum Vertical Laptop Stand Adjustable Desktop Holder For MacBook Notebooks,False,,Brand New,0,1994
Laptop DJ Mixer Tripod Stand for Notebook Projector Camera Home Adjustable,True,,Brand New,0,4007
Laptop Lap Tray With Cushioned Pillow Desk Bed Tray Portable Notebook Stand NEW,True,,Brand New,0,2047
Adjustable Portable Stand Holder Laptop Tablet Mount Universal for ipad Macbook,True,,Brand New,0,799
Portable Foldable Laptop Computer Desk Desktop Stand Bed Tray Cooling Rack BK,True,30,Brand New,0,1367
Ergonomic aluminum laptop Cooling Stand Mount Holder 10-15.6'' Notebook Computer,True,,Brand New,0,2798
New Listingmetal laptop stand,False,,Brand New,1859,960
Adjustable Laptop Stand Riser Foldable Laptop Computer Tablet Holder Portable US,False,,Brand New,0,1099
Foldable Laptop Desk Lap Bed Tray Adjustable Table Stand Bamboo Portable Desk US,True,,Brand New,0,2679
Car Steering Wheel Desk Laptop Auto Computer Mount Eating Table Tray Stand Black,True,,Brand New,0,1999
"Laptop Stand, Ergonomic Detachable Aluminum Stand. Compatible 10-16in Laptops",False,,Brand New,,1999
Universal Folding Portable Laptop Stand Holder For MacBook Pro/Air Black,False,,Brand New,0,799
New ListingFoldable Laptop Stand Portable ABS Computer Laptop Desk Adjustable Height Laptop,False,,Brand New,0,1342
Adjustable Laptop Stand with Cooling Fan Aluminium Alloy Multi-Angle Computer...,True,,Brand New,0,6514
"Height Adjustable Aluminum Laptop Stand for Macbook Pro/Air or laptop 11-15.6"" -",False,,Brand New,0,2999
Portable Laptop Notebook Table Foldable Stand Sofa Bed Lap Tray Computer Desk',False,0,Brand New,0,699
New ListingAdjustable Laptop Stand Tablet Holder Desktop Dock for MacBook Pro Air Notebook,False,,Brand New,0,977
"Laptop Stand for Desk, Aluminum Computer Riser, Ergonomic Laptops Elevator ",False,,Brand New,0,1499
Foldable Adjustable Laptop Stand Fr Desk Portable Notebook Riser Computer Holder,True,,Brand New,0,815
Adjustable Laptop Stand Tablet Holder Desktop Dock for MacBook Pro Air Notebook,True,,Brand New,0,899
Desk Laptop Stand w/Phone Holder Adjustable Foldable Portable Riser Sturdy,True,0,Brand New,0,1399
Adjustable Laptop Cooling Table Folding Lap Desk Portable Notebook Stand w/ Tray,False,,Brand New,0,1299
Portable Adjustable Laptop Stand Notebook Tablet Holder Fordable Computer Desk,True,,Brand New,0,1293
MOFT Lightweight Portable Laptop  Adjustable Stand Gold MacBook Universal,True,,Brand New,0,1357
,False,,,,
"Ergonomic Laptop Stand for Desk/Table Adjustable Height Up to 19""Foldable Lap...",True,,Brand New,0,4062
Extra Wide Adjustable Laptop Stand with Cooling Fan & Mouse Pad for 17 Inch C...,True,,Brand New,0,6374
Portable Adjustable Aluminum Laptop Stand Foldable Notebook Riser Tablet Holder ,False,214,Brand New,0,1089
Laptop stand portable Desk Table adjustable Angle & Height W/Lockable Casters NY,True,0,Brand New,0,3699
Adjustable Foldable Laptop Desktop Stand Notebook Tablet Holder Riser Portable,False,,Brand New,0,1059
Durable Portable Foldable Notebook Laptop Desk Table Stand Bed Tray W/Cup Pad,False,,Brand New,0,1600
Jarlink Vertical Laptop/Tablet Stand Holder Silver Metal,False,,Open Box,1054,200
2 PCS Laptop Monitor Stand Riser 3 Height Adjustable Computer Monitor stand,True,,Brand New,0,2199
Laptop Stand for Desk Portable Tray Vertical Holder Ergonomic Mac Riser for Bed,False,0,Brand New,0,2664
Portable Adjustable Notebook  Laptop Stand Tablet Holder Foldable Adjustable,True,,Brand New,0,798
Laptop Lap Tray With Cushioned Pillow Desk Bed Tray Portable Notebook Stand NEW,False,0,Brand New,0,1899
Vertical Laptop Stand HolderPortable Laptop Stand for Travel Outdoor School H...,True,,Open Box,0,2308
Portable Laptop Stand adjustable laptop holder Riser ,False,,Brand New,,1299
Adjustable Laptop Cooling Stand Folding Lap desk Sofa Table Bed Notebook w/Tray,False,,Brand New,0,2159
Portable Adjustable Aluminum Alloy Laptop Stand Notebook Tablet Holder Foldable,False,,Brand New,0,1099
Adjustable Foldable Laptop Cooling Pad Slim Stand Notebook PC With Cooler Fan,False,,Brand New,0,2299
Laptop Stand Notebook Riser Foldable Cooling Stand F Desk Ventilated Adjustable,True,0,Brand New,0,999
Portable Adjustable Laptop Stand Tablet Stand Riser Foldable Computer Desk,True,,Brand New,0,999
Adjustable Invisible Folding Laptop Computer PC Stand for MacBook Air Notebook,True,48,Brand New,,999
Laptop Stand - Bestand TI-Station Holder for MacBooks + All Laptops,False,,Pre-Owned,1494,99
Razer Laptop Stand,False,,Open Box,2156,2200
Portable Laptop Notebook Table Foldable Stand Sofa Bed Lap Tray Computer Desk,False,0,Brand New,0,2249
Adjustable Laptop Stand with Smartphone stand,False,,Pre-Owned,450,1499
360° Adjustable Foling Laptop Notebook Desk Fan Portable Bed Table Sofa Stand,False,,Refurbished,1500,1500
Foldable Laptop Stand Portable Adjustable Base Support Notebook Stand For Tablet,False,0,Brand New,0,1469
Durable Bed Tray Foldable Notebook Laptop Desk Table Stand with Phone Holder,False,,Brand New,499,2376
New ListingRain Design  ilevel2  Adjustable laptop stand,False,,Open Box,980,3999
Car Steering Wheel Tray Table Laptop Stand Desk Food Drink Holder Short Style,False,0,Brand New,0,1859
Portable Adjustable Aluminum Laptop Stand Foldable Notebook Riser Tablet Holder,True,,Brand New,0,1398
Portable Notebook Stand Adjustable Foldable Laptop Tablet Holder Computer Desk,False,,Brand New,,1134
Pro Laptop Projector Tripod Stand Universal Adjustable Foldable Holder Mount,True,,Brand New,0,3862
Foldable Laptop Stand Aluminum alloy Adjustable Notebook Tablet Computer Holder,True,95,Brand New,0,1295
Rolling Laptop Desk Height Angle Adjustable Overbed Sofa Food Tray Table Stand,False,,Brand New,0,4607
HUANUO Adjustable Laptop Stand with 2 CPU Cooling Fans Detachable Mouse Pad,False,,Pre-Owned,1500,3000
Portable Laptop Stand￼,False,,Brand New,299,399
"Laptop Stand, Portable Laptop Riser with 4 Fan, 7 Angles Adjustable Laptop Cooli",False,,Brand New,0,1448
Laptop Steering Wheel Desk Auto Car Computer Mount Holder Eating Tray Stand,False,,Brand New,0,1699
6-level Adjustable Laptop Portable Aluminum Alloy Laptop Stand G1T5,False,,Brand New,0,853
Adjustable Portable Notebook Tablet Holder Laptop Stand Foldable Computer Desk,False,,Brand New,0,989
MOFT Lightweight Portable Laptop  Adjustable Stand Silver MacBook Universal,True,,Brand New,0,1377
Laptop Cushion Desk Bed Pillow Cushioned Lap Tray Adjustable Stand 8 Position,True,,Brand New,,2199
Adjustable Bamboo Laptop Lap Tablet Desk Table Stand Folding Bed Tray w/ Drawer,True,143,Brand New,0,2299
New ListingAdjustable Folding 360°Notebook Laptop Desk Table Stand Bed Tray w/ Hole,False,,Brand New,0,2037
TriGear X-Wing Portable Adjustable Phone Stand Holder for Laptops and Tablets,False,,Brand New,0,1699
Height Adjustable Rolling Laptop Desk Cart Over Bed Hospital Table Stand White,True,,Brand New,0,3499
Portable Adjustable Notebook Tablet Holder Laptop Stand Foldable Computer Desk,True,,Brand New,0,798
Laptop Stand for Desk SOQOOL Computer Stand Riser for Desk Ventilated Ergonomic,False,,Brand New,0,2240
Rain Design mStand Laptop Stand,False,,Brand New,0,4375
"HUANUO Laptop Lap Desk - Fits up to 14 inches Laptop Stand with Phone Holder,",True,0,Open Box,0,1946
Macally Laptop Stand - Riser Stand for Desk - Aluminum Fits Any MacBook 10”-17”,False,,Pre-Owned,800,1999
"Laptop Stand, Portable Computer Laptop Mount Laptop Riser 6 Levels Height Adjust",True,,Brand New,,3367
Portable Laptop Stand Adjustable Foldable Notebook Tablet Holder Computer Desk,False,,Brand New,0,1295
Portable Adjustable Laptop Stand Notebook Tablet Holder Foldable Computer Desk,True,,Brand New,0,995
"NEW Laptop Stand, Ergonomic Aluminum Computer Stand for 10-17'' Notebook Silver",False,,Brand New,0,2499
Laptop Stand Portable Aluminum Alloy Computer Support with Cooling Fan for Home,False,,Brand New,0,3799
Rain Design iLevel2 Anodized Aluminum Height Adjustable Laptop Stand #12031,True,0,Brand New,0,5499
Portable Notebook Tablet Holder Laptop Stand Adjustable Foldable Computer Desk,True,,Brand New,0,1300
Double DJ Laptop Stand - 2 Tier PA Equipment PC Table Monitor CD Player Speakers,True,,Brand New,0,4195
"Portable Folding Laptop Table Laptop Stand Adjustable with Cooling Fan,Mouse Pad",False,,Brand New,0,1600
Portable 360° Adjustable Laptop Notebook Table Stand Tray Foldable Computer Desk,False,,Brand New,0,1686
Portable Adjustable Notebook Holder Laptop Stand Foldable stable Computer Desk,False,,Brand New,0,879
Portable Laptop Desk Foldable Table Bed with USB Cooling Fans Stand TV Tray,False,31,Brand New,0,1696
Portable Adjustable Laptop Stand Notebook Tablet Holder Foldable Computer Desk,True,,Brand New,0,809
Laptop Stand Adjustable Cooling Pad Desk Holder,False,,Brand New,549,1559
Laptop Stand Adjustable Aluminum Ergonomic Laptop Holder for 17.3 Inch Laptop...,True,,Brand New,0,5814
Portable Stand Bed Tray Sofa Adjustable Laptop Table Computer Desk Notebook Tray,False,,Brand New,0,1600
,False,,,,
"GIKERSY Laptop Stand Adjustable Height from 1.5"" to 20""Multi-Angle Ergonomic ...",True,,Brand New,0,8476
Adjustable Foldable Aluminum Laptop Stand Fr Desk Portable Notebook Riser Holder,True,20,Brand New,0,1296
Laptop Stand 360° Adjustable Notebook Riser Table Desk Holder Mouse Tray w/2 Fan,True,,Brand New,0,3403
Adjustable Laptop Notebook Rolling Table Desk Stand Overbed Tiltable Tabletop,True,704,Brand New,0,4498
Rolling Height Angle Adjustable Laptop Sofa Desk Overbed Food Tray Table Stand,True,1543,Brand New,0,4498
DJ Double Computer Laptop Stand - Duel Mount Holder Studio Mixer Controller Gear,True,,Brand New,0,4200
"BOYATA-15"" Laptop Stand Rose Gold",False,,Pre-Owned,1595,300
Portable Adjustable Aluminum Laptop Stand Foldable Notebook Riser Tablet Holder,False,,Brand New,0,839
Portable Office Laptop Desk Rolling Adjustable Table Cart Computer Mobile Stand,True,,Brand New,0,7799
Adjustable Foldable Lap Desk for Laptop Tray Laptop Stand With Mouse Pad /Fan,True,0,Brand New,0,2390
2Pcs Universal Portable Mini Laptop Stand Invisible Foldable Desktop Notebook,False,,Brand New,0,989
"Nulaxy  Aluminum Desktop Laptop Stand 10"" - 15.8"" ",False,,Open Box,800,2150
New ListingLaptop Stand Portable Aluminum Alloy Computer Support with Cooling Fan,False,,Brand New,0,4066
Razer Laptop Stand Chroma - Ergonomic Design - 3-Port USB 3.0 Hub,False,0,Brand New,0,9999
Portable Adjustable Notebook Tablet Holder Laptop Stand Foldable Computer Tray,False,,Brand New,,1170
Portable Adjustable Aluminum alloy Laptop Stand Notebook Tablet Holder Foldable,False,,Brand New,0,1499
Portable Adjustable Notebook Tablet Holder Laptop Stand Foldable Computer Desk,True,,Brand New,0,798
360° Rotation Laptop Table Stand Lap Sofa Bed Tray Computer Notebook Home Desk,False,,Brand New,,1998
"Adjustable 47""/63"" Laptop Tripod Stand Projector Stand Camera Holder w/Tray ",True,,Brand New,0,2603
Mobotron Standard Universal Car iPad Notebook Laptop Mount Holder Stand MS-426 R,False,469,Refurbished,0,10750
Ergonomic Keyboard Laptop Tablet Mouse Stand Holder Mount for Workstation Chair,False,,Pre-Owned,3139,3100
Laptop aluminum stand Ergonomic stand ， easy to carry Suitable for 10-17  laptop,True,,Brand New,0,1589
Vertical Laptop Stand Ventilated Desktop Aluminum Holder (Adjustable Dock Size)C,False,,Brand New,0,2537
Laptop Stand Ergonomic Aluminum Computer Stand Remove for 10-18'' Notebook BK/SR,False,,Brand New,0,1234
"Aluminum Portable Laptop Stand - Adjustable, Universal Compatibility (BLACK)",False,,Brand New,200,999
HUANUO Adjustable Laptop Stand with 2 CPU Cooling Fans Detachable Mouse Pad,False,,Brand New,2435,3000
"HUANUO Laptop Lap Desk - Fits up to 14 inches Laptop Stand with Phone Holder,Tab",False,,Brand New,0,2099
Laptop Steering Wheel Desk Auto Car Computer Mount Holder Eating Tray Stand NEW,True,0,Brand New,0,1580
Razer Laptop Stand for Razer Blade Gaming Laptop Stealth - Ergonomic Design,False,0,Brand New,0,4999
 Adjustable Aluminum Laptop Stand with Mouse Pad w cooling Fan,False,,Brand New,0,1999
Razer Laptop Stand for Razer Blade Gaming Laptop Stealth - Ergonomic Design,False,0,Brand New,0,4500
""" - Ergonomic Laptop Stand (BLUKF-13-BL)",False,,Brand New,550,800
Adjustable Foldable Laptop Stand Desk Portable Notebook Riser Computer Holder US,False,,Brand New,0,829
"Besign Adjustable Tablet Laptop & Phone Stand, Ergonomic Riser Notebook Holder*",False,,Open Box,1000,999
New ListingRain Design 10032 Laptop Stand - Silver,False,,Brand New,1465,1500
Laptop Cushion Desk Bed Pillow Cushioned Lap Tray Adjustable Stand Computer Blue,True,0,Brand New,0,2577
"NEW!!  Laptop Stand, Ergonomic Aluminum Computer Stand for 10-17'' Notebook",True,70,Brand New,0,1699
Portable Laptop Notebook Table Foldable Stand Sofa Bed Lap Tray Computer Desk,False,,Brand New,0,2289
Portable Adjustable Notebook Tablet Holder Laptop Stand Foldable Computer Desk,True,,Brand New,0,1047
Adjustable Portable Foldable Laptop Stand Holder For MacBook Dell Lenovo Asus,True,,Brand New,0,1398
Puzmug Laptop Stand Aluminum,False,,Open Box,1425,100
Portable Laptop Notebook Table Foldable Stand Sofa Bed Lap Tray Computer Desk,False,,Brand New,0,1999
"Keyboard Riser, Keyboard Stand for Desk,Laptop Stand for Desk, Portable Laptop S",True,0,,0,1152
 Universal Portable Mini Laptop Stand Invisible Foldable Desktop Notebook 1 Pair,False,,Brand New,0,999
New ListingNIB Adjustable Lap Desk w/ 8 Adjustable Angles & Dual Cushions Laptop Stand for,False,,Brand New,0,2129
Adjustable Height Laptop Desk Book Stand for Bed Portable Foldable Computer Tray,False,,Brand New,0,1994
STANTON Uberstand Laptop riser stand,False,,Pre-Owned,1375,3800
Laptop Desk Angle Height Adjustable Rolling Cart Over Bed Hospital Table Stand,True,,Brand New,0,3498
SKYZONAL Laptop Stand Aluminum Ventilated Stand Ergonomic Riser Silver,True,,Brand New,0,1823
Laptop Stand W Phone Holder Foldable Computer Lift 360 Rotating Swivel Base,True,0,Brand New,0,2609
Portable Adjustable Laptop Notebook Tablet Holder Stand Foldable Computer Desk,False,,Brand New,0,1289
Portable Folding Car Steering Wheel Desk Laptop Mount Back Seat Food Tray Stand,True,,Brand New,0,2289
Silicone Laptop Stand Adjustable Bracket Desktop Computer Cooling Base Holder~,False,,Brand New,0,253
 YEZRO Adjustable Foldable Laptop Stand  Portable Notebook Riser Computer Holder,True,,Brand New,835,999
"New ListingHUANUO Adjustable Laptop Stand Riser for Desk, Fits Up to 15.6 inch Notebook, 8",False,,Brand New,0,3398
"Vecukty Laptop Stand Ergonomic, Portable, Height Adjusting Sturdy Nonslip",False,,Brand New,0,2390
Durable Portable Foldable Notebook Laptop Desk Table Stand Bed Tray W/Cup Pad,False,,Brand New,0,1999
