name,free_returns,items_sold,items_status,items_shipping,price
"Computer Keyboard/Laptop Stand, Portable Anti-Slip, Zinc Alloy, Foldable",True,,Brand New,0,2075
Griffin Elevator Laptop Stand for Laptops Space Grey,False,,Refurbished,1000,1500
Portable Adjustable Aluminum alloy Laptop Stand Notebook Tablet Holder Foldable,False,,Brand New,0,955
"New Listing Laptop Stand, Aluminum Computer Riser, Ergonomic Laptops Elevator A- silver",True,,Brand New,0,4114
Portable Adjustable Laptop Stand Notebook Tablet Holder Foldable Computer Desk,True,,Brand New,0,1436
Portable Laptop Desk Folding Foldable Lap Tray Bed Adjustable Table Stand + LED,False,,Brand New,0,3199
Portable Laptop Adjustable Cooling Stand,False,,Brand New,0,652
Foldable Laptop Stand Lightweight Adjustable Notebook Holder Macbook Air/Pro,True,,Brand New,0,1295
Foldable Portable Aluminum Adjustable Laptop Stand Notebook Tablet Desk Holder,True,,Brand New,0,1448
